case_id	label	tree_file	generating_model	expected_selected_model	root_state	sigma	alpha	theta	rate_change	lambda_value	kappa	delta	seed	candidate_modes	lambda_lower	lambda_upper	kappa_lower	kappa_upper	delta_lower	delta_upper	ou_lower	ou_upper	early_burst_lower	early_burst_upper	sigma_squared_tolerance	alpha_tolerance	theta_tolerance	rate_change_tolerance	lambda_tolerance	kappa_tolerance	delta_tolerance	expected_warning_kinds	notes
brownian-sigma-recovery	Brownian sigma recovery	trees/reference-tree-twelve-taxa.nwk	brownian	brownian	2.5	0.8							18	brownian,ornstein-uhlenbeck,early-burst	0	1	0	3	0	3	0	10	0	50	0.1								Brownian simulation should recover sigma squared and remain preferred over OU and early-burst on the governed twelve-taxon review tree.
ou-parameter-recovery	OU parameter recovery	trees/reference-tree-twelve-taxa.nwk	ornstein-uhlenbeck	ornstein-uhlenbeck	2.0	0.7	1.0	2.8					2	brownian,ornstein-uhlenbeck,early-burst	0	1	0	3	0	3	0	10	0	50	0.45	0.35	0.5					flat_likelihood,weak_pull_to_optimum	OU simulation should recover alpha, optimum, and sigma squared within a realistic fitContinuous tolerance band while OU remains preferred over BM and early-burst on the governed twelve-taxon review tree.
early-burst-rate-recovery	Early-burst rate recovery	trees/reference-tree-twelve-taxa.nwk	early-burst	early-burst	3.0	0.8			4.0				4	brownian,ornstein-uhlenbeck,early-burst	0	1	0	3	0	3	0	10	0	10	0.05			0.25				flat_likelihood_profile	Early-burst simulation should recover a positive rate-change parameter and remain preferred over Brownian and OU on the governed twelve-taxon review tree.
weak-ou-identifiability	Weak OU identifiability review	trees/reference-tree-twelve-taxa.nwk	ornstein-uhlenbeck	brownian	2.0	0.3	0.05	2.1					17	brownian,ornstein-uhlenbeck,early-burst	0	1	0	3	0	3	0	10	0	50								flat_likelihood,weak_pull_to_optimum	Weak OU pull should stay near the Brownian surface, trigger identifiability warnings, and remain a review case rather than a truth-recovery pass case.
lambda-transformed-branch-review	Pagel-lambda transformed-branch review	trees/reference-tree-twenty-four-taxa.nwk	pagel-lambda		0.5	0.8				0.7			32024	brownian,white-noise,pagel-lambda,pagel-kappa,pagel-delta,ornstein-uhlenbeck,early-burst	0	1	0	3	0	3	0	10	0	50	0.25				0.2			flat_likelihood	Brownian simulation on a Pagel-lambda transformed twenty-four-taxon tree should recover a reduced lambda value and compare Bijux recovery directly against the stored local geiger fitContinuous lambda recovery.
kappa-transformed-branch-review	Pagel-kappa transformed-branch review	trees/reference-tree-twenty-four-taxa.nwk	pagel-kappa		0.5	0.8					2.0		32024	brownian,white-noise,pagel-lambda,pagel-kappa,pagel-delta,ornstein-uhlenbeck,early-burst	0	1	0	3	0	3	0	10	0	50						0.35		flat_likelihood	Brownian simulation on a Pagel-kappa transformed twenty-four-taxon tree should recover an elevated kappa value and compare Bijux recovery directly against the stored local geiger fitContinuous kappa recovery.
delta-transformed-branch-review	Pagel-delta transformed-branch review	trees/reference-tree-twenty-four-taxa.nwk	pagel-delta		0.5	0.8						0.6	32024	brownian,white-noise,pagel-lambda,pagel-kappa,pagel-delta,ornstein-uhlenbeck,early-burst	0	1	0	3	0	3	0	10	0	50	0.1						0.1	flat_likelihood	Brownian simulation on a Pagel-delta transformed twenty-four-taxon tree should recover an early-change delta value and compare Bijux recovery directly against the stored local geiger fitContinuous delta recovery.
